### ISSUE TITLE
Streaming using yield seems broken?

### ISSUE THREAD

**Issue by flixman** [Corvusoft/restbed#387]
Hi Corvusoft,

I think I need help: I'm trying to set up a jpeg streamer, which I am doing using yield. Should I use this construct:

    void get_webcamsServer( const shared_ptr< Session > session )
    {
        const auto request = session->get_request( );
        const int cameraIdx = stoi( request->get_path_parameter( "camera" ) );
        const string body( frames[ cameraIdx ]->begin(), frames[ cameraIdx ]->end() );

        const multimap< string, string > headers
        {            
            {"Pragma", "no-cache" },
            {"Expires", "Mon, 3 Jan 2000 12:34:56 GMT" },
            { "Content-Type", " image/jpeg" }
        };
        session->yield( OK, body, headers );
    }

... a single picture is sent to the client, so this is OK... but is not "streaming". As I want to send the stream as in a multipart response, I code the following:

    void get_webcamsServer( const shared_ptr< Session > session )
    {
        const auto request = session->get_request( );
        const int cameraIdx = stoi( request->get_path_parameter( "camera" ) );

        const multimap< string, string > headers
        {
            {"Connection", "close" },
            {"Cache-Control", "no-store, no-cache, must-revalidate, pre-check=0, post-check=0, max-age=0" },
            {"Pragma", "no-cache" },
            {"Expires", "Mon, 3 Jan 2000 12:34:56 GMT" },
            { "Content-Type", "multipart/x-mixed-replace; boundary=frame" }
        };
        session->yield( OK, "--frame", headers );

        while ( true )
        {
            const string body( frames[ cameraIdx ]->begin(), frames[ cameraIdx ]->end() );
    
            const string imgContent = "Content-Type: image/jpeg\r\n" \
                                "Content-Length: " + ::to_string( body.length( ) ) + "\r\n" \
                                "\r\n" + body + "\r\n--frame\r\n";
            session->yield( imgContent );

            this_thread::sleep_for(chrono::seconds(1));
        }
    }

... nothing is received in the browser. What am I doing wrong?

**Comment by ben-crowhurst** [comment]
I've managed to replicate this issue, thank you for providing an example.  We are actively working on it now.

**Comment by flixman** [comment]
@ben-crowhurst Is there any thing I can do to help?

**Comment by ben-crowhurst** [comment]
@flixman thanks for the offer, I'll let you know.  I'm looking into this issue today.

**Comment by ben-crowhurst** [comment]
@flixman does your example return data when used via curl or wget command line tools?  Is this issue specifically a browser-based problem?

**Comment by ben-crowhurst** [comment]
You state in your example the the `boundary=frame`
```
{ "Content-Type", "multipart/x-mixed-replace; boundary=frame" }
```
Yet you use `--frame` within the reponse.

**Comment by ben-crowhurst** [comment]
You also appear to be missing the terminating `--`.

**Comment by ben-crowhurst** [comment]
If you use wireshark I think you'll see the data being transmitted to the browser. Can you attempt this and let me know the results and the answers to the questions above; thanks.

**Comment by ben-crowhurst** [comment]
Here is an example of what you are aiming to reproduce.
```
POST / HTTP/1.1
Connection: Keep-Alive
Content-Type: multipart/form-data; boundary=frame

--frame
Content-Disposition: form-data; name="image" filename="image.jpg"

content of image.jpg
--frame--
```

**Comment by ben-crowhurst** [comment]
[fyi] I've created a ticket to update the Restbed documentation with an example at a later date.

**Comment by flixman** [comment]
Hi Ben, thank you for giving a look to this issue :-) During this time I have changed a bit the program, but the issue still happens. With this code:

    void get_webcamsServer( const shared_ptr< Session > session )
    {
        const auto request = session->get_request( );
        const int cameraIdx = stoi( request->get_path_parameter( "camera" ) );

        {
            unique_lock<mutex> lk( *mutexes[ cameraIdx ] );
            body[ cameraIdx ].reset( new string( frames[ cameraIdx ]->begin(), frames[ cameraIdx ]->end() ) );
        }

        const multimap< string, string > headers
        {
            {"Cache-Control", "no-store, no-cache, must-revalidate, pre-check=0, post-check=0, max-age=0" },
            {"Pragma", "no-cache" },
            {"Expires", "Mon, 3 Jan 2000 12:34:56 GMT" },
            { "Content-Type", "multipart/x-mixed-replace; boundary=frame" }
        };

        session->yield( OK, "--frame", headers );
        int i=0;
        while ( i++ < 3 )
        {
            const string bodyTmp = *body[ cameraIdx ];

            const string imgContent = "Content-Type: image/jpeg\r\n" \
                                "Content-Length: " + ::to_string( bodyTmp.length( ) ) + "\r\n" \
                                "\r\n" + bodyTmp + "\r\n--frame--\r\n";
            session->yield( imgContent );
            this_thread::sleep_for(chrono::seconds(1));
        }
    
        session->close();
    }

I would expect to receive 3 frames, each one a second apart. When sniffing the network with wireshark, this is what I get:

Time	Protocol	Length	Info
0.025218546	HTTP	401	GET /cameras/0 HTTP/1.1 
0.025225109	TCP	66	80 → 40994 [ACK] Seq=1 Ack=336 Win=65152 Len=0 TSval=1978470091 TSecr=1978470091
3.031429318	TCP	296	80 → 40994 [PSH, ACK] Seq=1 Ack=336 Win=65536 Len=230 TSval=1978473098 TSecr=1978470091 [TCP segment of a reassembled PDU]
3.031485493	TCP	66	40994 → 80 [ACK] Seq=336 Ack=231 Win=65408 Len=0 TSval=1978473098 TSecr=1978473098
3.031896667	TCP	24930	80 → 40994 [PSH, ACK] Seq=231 Ack=336 Win=65536 Len=24864 TSval=1978473098 TSecr=1978473098 [TCP segment of a reassembled PDU]
3.031933407	TCP	66	40994 → 80 [ACK] Seq=336 Ack=25095 Win=52480 Len=0 TSval=1978473098 TSecr=1978473098
3.032084483	TCP	24930	80 → 40994 [PSH, ACK] Seq=25095 Ack=336 Win=65536 Len=24864 TSval=1978473098 TSecr=1978473098 [TCP segment of a reassembled PDU]
3.032108905	TCP	66	40994 → 80 [ACK] Seq=336 Ack=49959 Win=52480 Len=0 TSval=1978473098 TSecr=1978473098
3.032242134	TCP	24930	80 → 40994 [PSH, ACK] Seq=49959 Ack=336 Win=65536 Len=24864 TSval=1978473098 TSecr=1978473098 [TCP segment of a reassembled PDU]
3.032315303	TCP	66	40994 → 80 [ACK] Seq=336 Ack=74823 Win=39424 Len=0 TSval=1978473098 TSecr=1978473098
3.032429844	HTTP	66	HTTP/1.1 200 OK 

As you can see, seems all frames are being sent on the call to session->close(). I have checked the contents of the frames whose size is 24930, and they have the --frame-- at the end... but everything still happens when the connection is closed instead of at the rate it is happening.

**Comment by ben-crowhurst** [comment]
Please read the specification [RFC1867](https://www.ietf.org/rfc/rfc1867.txt). Could you also answer my other questions posted above?

Removing the while-loop and using a yield callback would also be the desired approach. The close should happen inside the last call to yield.
``` C++
void yield( const std::string& data, const std::function< void ( const std::shared_ptr< Session > ) >& callback = nullptr );
```
If you can provide an easily compilable example, see regression test cases, I can debug further on my end.

**Comment by flixman** [comment]
Sorry, right: with wget I obtain the same behavior. Nothing comes from the server until the connection is closed. Also, what I read (but not properly, as you can see) was the RFC 1341, specifically the point 7.2 (Multipart Content type), which I have done now... but I still have the issue. With this example:

    #include <thread>
    #include <restbed>

    using namespace std;
    using namespace restbed;

    void get_webcamsServer( const shared_ptr< Session > session )
    {
        const multimap< string, string > headers
        {
            {"Cache-Control", "no-store, no-cache, must-revalidate, pre-check=0, post-check=0, max-age=0" },
            {"Pragma", "no-cache" },
            {"Expires", "Mon, 3 Jan 2000 12:34:56 GMT" },
            { "Content-Type", "multipart/x-mixed-replace; boundary=frame" }
        };

        session->yield( OK, headers );
        
        for (int i=0; i<3; i++)
        {
            const string payload("This is a string");
            const string imgContent = "--frame\r\nContent-Type: text/plain\r\n\r\n" + payload + "\r\n";
            session->yield( imgContent );

            this_thread::sleep_for(chrono::seconds(2));
        }    

        // final yield, which closes the session
        session->yield( string("--frame--\r\n"),  [](const std::shared_ptr< Session > session) { session->close(); });
    }


    int main()
    {
        auto webcamsServer = make_shared< Resource >();
        webcamsServer->set_path( "/cameras/{camera: [0-9]*}" );
        webcamsServer->set_method_handler( "GET", get_webcamsServer );

        auto settings = make_shared< Settings >();
        settings->set_port( 80 );

        Service service;
        service.publish( webcamsServer );
        service.start( settings );

        return 0;
    }

Which I build by running "g++ -O2 -ggdb3 -std=c++14  -o main_simple main_simple.cpp -Irestbed", this is what I get after roughly 6 seconds:

    $ wget -q -S -O - http://127.0.0.1/cameras/0
    HTTP/1.1 200 OK
    Cache-Control: no-store, no-cache, must-revalidate, pre-check=0, post-check=0, max-age=0
    Content-Type: multipart/x-mixed-replace; boundary=frame
    Expires: Mon, 3 Jan 2000 12:34:56 GMT
    Pragma: no-cache
    --frame
    Content-Type: text/plain

    This is a string
    --frame
    Content-Type: text/plain

    This is a string
    --frame
    Content-Type: text/plain

    This is a string
    --frame--

... in one go, instead of receiving each one of the frames apart. Also, considering this will run on an infinite loop (serving frames of a webcam) how can I use the callbacks without getting a stack overflow due to the recursion?

**Comment by KevinSmild** [comment]
@ben-crowhurst , is there a way of achieving this with restbed?

Thanks in advance,
Kevin Baez.

**Comment by KevinSmild** [comment]
@ben-crowhurst, the mjpeg server is totally doable and gives good performance using restbed.
Thanks.

**Comment by flixman** [comment]
@ben-crowhurst Is there anything I can do to help you debug this problem?

**Comment by ben-crowhurst** [comment]
@KevinSmild would you be able to share your experience with @flixman?

**Comment by KevinSmild** [comment]
This a simple code snippet  for the problem. @ben-crowhurst  @flixman 
I havent found a way to figure out when does the browser client closes the connection. But other than that,
the code works fine. 

Let me know if you have any troubles. 

```cpp
const std::multimap<std::string, std::string> gHeaders{
    {"Connection", "Keep-Alive"},
    {"Cache-Control", "no-store, no-cache, must-revalidate, pre-check=0, post-check=0"},
    {"Pragma", "no-cache"},
    {"Content-Type", "multipart/x-mixed-replace; boundary=frame"},
    {"Access-Control-Allow-Origin", "*"}};

auto handler = 
    [this](const std::shared_ptr<restbed::Session> session) {
        /* Code for your encoded image */
        // Assume image is encoded as a string an is available in the "image" variable
        std::stringstream ss;
        ss << "--frame\r\nContent-type: image/jpg\r\n\r\n" << image << "\r\n";
        session->yield(ss.str(), handler);
    };

restbed::Resource resource;
resource.set_path("/mjpeg/stream0");
resource.set_method_handler(
    "GET", [this](const shared_ptr<restbed::Session> session) {
        session->yield(restbed::OK, gHeaders, handler);
    });

```

**Comment by flixman** [comment]
@ben-crowhurst @KevinSmild Indeed, with the snippet from Kevin all seems to work. Thank you very much, guys!
